{
  "id": "4f0c8a3b-6d5e-4f7a-9b2c-3d4e5f6a7b82",
  "type": "controle.resultat",
  "version": 1,
  "emitted_at": "2026-11-02T09:15:01.874Z",
  "correlation_id": "7a9d2e14-c6b3-4f81-a0d5-e2c47b19f863",
  "data": {
    "article_id": "3f1c2a8e-5b7d-4e2a-9c1f-6d8b0a4e7c21",
    "revision": 1,
    "rules_version": 3,
    "issue": "a_verifier",
    "reason": "vendeur_a_verifier"
  }
}
