{
  "id": "b7d9f1a3-5c2e-4b4d-9f6a-8e0c2a4b6d8f",
  "type": "controle.resultat",
  "version": 1,
  "emitted_at": "2026-11-03T13:30:13Z",
  "correlation_id": "6f1b3d5e-7a9c-4e2d-b4f6-8a0c2e4f6b8d",
  "data": {
    "article_id": "c3e5a7b9-d1f2-4a4c-8e6a-0b2d4f6a8c0e",
    "revision": 1,
    "rules_version": 2,
    "issue": "a_verifier"
  }
}
