{
  "id": "a4c6e8f0-1b3d-4f5a-8c7e-9d0b2f4a6c8e",
  "type": "controle.resultat",
  "version": 1,
  "emitted_at": "2026-11-02T10:02:42.310Z",
  "correlation_id": "2c8e4a61-9b7d-4f3e-a5c1-d0e2f4a6b8c9",
  "data": {
    "article_id": "8a2d4f6b-1c3e-4a5b-9d7f-0e2c4a6b8d1f",
    "revision": 3,
    "rules_version": 1,
    "issue": "refuse",
    "reason": "annonce_incomplete"
  }
}
